number,value,datetime_start,datetime_complete,duration,params_loss,params_lr,params_n_feats,params_num_blocks,params_num_heads,params_optimizer,params_patch_size,params_scheduler,params_weight_decay,params_window_size,state
0,27.724370574951173,2026-10-05 21:35:04.131954,2026-10-05 22:24:51.189348,0 days 00:49:47.057394,Charbonnier,3.135775732257744e-05,88,3.0,2,ADAM,192.0,step,1.2562773503807034e-05,16.0,COMPLETE
1,28.048748016357422,2026-10-05 22:24:51.321884,2026-10-05 23:12:15.431681,0 days 00:47:24.109797,L2,3.385226783451975e-05,96,2.0,2,AdamW,160.0,step,3.632486956676606e-05,12.0,COMPLETE
2,27.941124725341798,2026-10-05 23:12:15.564990,2026-10-06 00:01:51.894227,0 days 00:49:36.329237,Huber,0.00020512599422151375,96,2.0,4,AdamW,224.0,step,3.9459088110999995e-06,16.0,COMPLETE
3,29.069482040405273,2026-10-06 00:01:52.058193,2026-10-06 00:56:10.978056,0 days 00:54:18.919863,Charbonnier,0.00020410334065257057,64,4.0,2,AdamW,128.0,cosine,3.0296104428212496e-05,12.0,COMPLETE
4,30.186024856567382,2026-10-06 00:56:11.113444,2026-10-06 01:47:55.277294,0 days 00:51:44.163850,L2,0.00032842103509117315,96,4.0,2,AdamW,192.0,cosine,4.149795789891592e-05,8.0,COMPLETE
5,28.215488815307616,2026-10-06 01:47:55.386015,2026-10-06 02:35:37.031759,0 days 00:47:41.645744,L2,6.995363653959081e-05,120,2.0,2,AdamW,128.0,step,7.991621920384356e-06,16.0,COMPLETE
6,27.87568359375,2026-10-06 02:35:37.172223,2026-10-06 03:23:39.905911,0 days 00:48:02.733688,Huber,3.5074840789944696e-05,80,2.0,4,ADAM,160.0,fixed,3.627066608804412e-06,12.0,COMPLETE
7,27.890755462646485,2026-10-06 03:23:40.054770,2026-10-06 04:16:55.769873,0 days 00:53:15.715103,L1,1.4393910893270896e-05,64,4.0,4,AdamW,160.0,fixed,0.0004916400722913762,12.0,COMPLETE
8,30.22168846130371,2026-10-06 04:16:55.924113,2026-10-06 05:07:59.095782,0 days 00:51:03.171669,L2,0.0001621702307943825,128,3.0,16,AdamW,192.0,fixed,5.149288946949016e-06,8.0,COMPLETE
9,29.590761947631837,2026-10-06 05:07:59.223413,2026-10-06 05:55:43.997285,0 days 00:47:44.773872,L2,0.00012492175283159113,80,2.0,8,AdamW,160.0,cosine,3.398850311078454e-06,8.0,COMPLETE
10,29.468695068359374,2026-10-06 05:55:44.152444,2026-10-06 06:45:24.114193,0 days 00:49:39.961749,L1,0.00041890886041651685,128,3.0,16,ADAM,192.0,fixed,1.0887633888418055e-06,8.0,COMPLETE
11,30.304429626464845,2026-10-06 06:45:24.257112,2026-10-06 07:37:45.422633,0 days 00:52:21.165521,L2,0.00039043642911832337,112,4.0,16,AdamW,192.0,cosine,0.00018341264676154025,8.0,COMPLETE
12,30.062166595458983,2026-10-06 07:37:45.561203,2026-10-06 08:27:49.589463,0 days 00:50:04.028260,L2,0.0001168099520960155,112,3.0,16,AdamW,192.0,fixed,0.00029693796441449666,8.0,COMPLETE
13,30.094222259521484,2026-10-06 08:27:49.697366,2026-10-06 09:20:10.760718,0 days 00:52:21.063352,L2,0.0004885313857123718,112,4.0,16,AdamW,192.0,cosine,0.00015521255515224666,8.0,COMPLETE
14,27.422871398925782,2026-10-06 09:20:10.906959,2026-10-06 09:27:08.696421,0 days 00:06:57.789462,L2,0.0002414419100268729,128,3.0,16,ADAM,224.0,cosine,9.737729195647202e-05,8.0,PRUNED
15,30.02591896057129,2026-10-06 09:27:08.841199,2026-10-06 10:17:05.984193,0 days 00:49:57.142994,L2,0.00011727637309464825,112,3.0,16,AdamW,192.0,fixed,0.0006924920297434953,8.0,COMPLETE
16,27.64373893737793,2026-10-06 10:17:06.125081,2026-10-06 10:23:28.045112,0 days 00:06:21.920031,Charbonnier,7.06673875616883e-05,120,4.0,8,AdamW,192.0,cosine,9.523536562820681e-05,8.0,PRUNED
17,,2026-10-06 10:23:28.149542,2026-10-06 10:23:28.388316,0 days 00:00:00.238774,,,120,,16,,,,,,PRUNED
18,,2026-10-06 10:23:28.499021,2026-10-06 10:23:28.770969,0 days 00:00:00.271948,,,104,,16,,,,,,PRUNED
19,29.635773849487304,2026-10-06 10:23:28.869678,2026-10-06 11:13:33.271722,0 days 00:50:04.402044,L1,0.0002677695951664379,128,3.0,16,AdamW,192.0,fixed,1.2029971025649774e-06,8.0,COMPLETE
20,27.516936111450196,2026-10-06 11:13:33.437814,2026-10-06 11:20:04.219129,0 days 00:06:30.781315,Huber,0.00015482926167116468,104,4.0,8,ADAM,224.0,cosine,1.7472974963136478e-05,8.0,PRUNED
21,30.2387939453125,2026-10-06 11:20:04.343219,2026-10-06 12:12:53.624510,0 days 00:52:49.281291,L2,0.0003531093697089976,104,4.0,2,AdamW,192.0,cosine,4.706647153281607e-05,8.0,COMPLETE
22,30.25742835998535,2026-10-06 12:12:53.766624,2026-10-06 13:05:24.618853,0 days 00:52:30.852229,L2,0.0003494423976183291,104,4.0,2,AdamW,192.0,cosine,0.00017413914472238815,8.0,COMPLETE
23,30.235258865356446,2026-10-06 13:05:24.770226,2026-10-06 13:57:57.001830,0 days 00:52:32.231604,L2,0.0003149312851376857,104,4.0,2,AdamW,192.0,cosine,0.00021596018238130191,8.0,COMPLETE
24,30.189668273925783,2026-10-06 13:57:57.113027,2026-10-06 14:50:32.567571,0 days 00:52:35.454544,L2,0.0004045397926452827,88,4.0,2,AdamW,128.0,cosine,6.87863246970207e-05,8.0,COMPLETE
25,30.25093002319336,2026-10-06 14:50:32.699468,2026-10-06 15:43:29.321193,0 days 00:52:56.621725,L2,0.0004738149530118309,104,4.0,2,AdamW,192.0,cosine,0.00034051520916194097,16.0,COMPLETE
26,30.367637634277344,2026-10-06 15:43:29.612372,2026-10-06 16:36:30.189621,0 days 00:53:00.577249,L2,0.00046570041311233334,112,4.0,2,AdamW,192.0,cosine,0.0009217288293720986,16.0,COMPLETE
27,30.146025085449217,2026-10-06 16:36:30.302038,2026-10-06 17:29:18.087501,0 days 00:52:47.785463,L2,0.00027195952978200516,112,4.0,2,AdamW,192.0,cosine,0.0008548541746538431,16.0,COMPLETE
28,27.5045223236084,2026-10-06 17:29:18.223628,2026-10-06 17:36:15.465793,0 days 00:06:57.242165,Charbonnier,8.559713716565611e-05,120,4.0,8,ADAM,192.0,cosine,0.0004446698140134577,16.0,PRUNED
29,27.727023315429687,2026-10-06 17:36:15.595143,2026-10-06 17:43:18.699431,0 days 00:07:03.104288,Huber,0.00019800164586487713,112,4.0,2,AdamW,224.0,cosine,0.00016643281651839722,16.0,PRUNED
30,27.52509307861328,2026-10-06 17:43:18.812085,2026-10-06 17:49:34.577350,0 days 00:06:15.765265,L1,4.939850674287965e-05,88,4.0,4,AdamW,128.0,cosine,0.0008877039888362643,16.0,PRUNED
31,30.255953216552733,2026-10-06 17:49:34.708253,2026-10-06 18:42:23.520674,0 days 00:52:48.812421,L2,0.0004617673582490247,104,4.0,2,AdamW,192.0,cosine,0.00035195057552866196,16.0,COMPLETE
32,27.8912410736084,2026-10-06 18:42:23.632432,2026-10-06 18:48:46.009290,0 days 00:06:22.376858,L2,1.4615563531535753e-05,96,4.0,2,AdamW,192.0,cosine,0.00024212448416392074,16.0,PRUNED
33,30.161217498779298,2026-10-06 18:48:46.135522,2026-10-06 20:09:50.044487,0 days 01:21:03.908965,L2,0.0003716854712472733,96,4.0,2,AdamW,192.0,cosine,0.000538316254307848,16.0,COMPLETE
34,29.392244720458983,2026-10-06 20:09:50.161807,2026-10-06 20:26:40.535955,0 days 00:16:50.374148,L2,0.0004898339047566052,112,4.0,2,AdamW,192.0,step,0.0001366880692591907,16.0,PRUNED
35,29.150418090820313,2026-10-06 20:26:40.650577,2026-10-06 20:38:39.945643,0 days 00:11:59.295066,L2,0.00031664481048086123,96,3.0,2,AdamW,192.0,step,0.000980342356390776,16.0,PRUNED
36,27.699421310424803,2026-10-06 20:38:40.081578,2026-10-06 20:44:54.219658,0 days 00:06:14.138080,Charbonnier,0.00023626166618560276,104,4.0,2,ADAM,192.0,cosine,0.00034711453113110355,12.0,PRUNED
37,28.020764923095705,2026-10-06 20:44:54.361675,2026-10-06 20:51:11.891669,0 days 00:06:17.529994,L2,0.00018096450897744852,120,4.0,2,AdamW,160.0,cosine,0.0005976193738480056,16.0,PRUNED
38,27.877421569824218,2026-10-06 20:51:12.001401,2026-10-06 20:57:26.666007,0 days 00:06:14.664606,L2,2.0032267585259198e-05,96,4.0,4,AdamW,192.0,step,9.439597147025204e-05,12.0,PRUNED
39,27.841564178466797,2026-10-06 20:57:26.792656,2026-10-06 21:03:49.964682,0 days 00:06:23.172026,Huber,0.0002990204186408662,104,4.0,2,AdamW,128.0,cosine,2.2315924722409694e-05,16.0,PRUNED
40,27.545178985595705,2026-10-06 21:03:50.107413,2026-10-06 21:09:56.344677,0 days 00:06:06.237264,Charbonnier,0.0003645363634339819,80,3.0,2,AdamW,224.0,cosine,0.00022137957322505245,16.0,PRUNED
41,30.27004051208496,2026-10-06 21:09:56.502407,2026-10-06 22:02:35.065704,0 days 00:52:38.563297,L2,0.0004934016339890112,104,4.0,2,AdamW,192.0,cosine,0.00034881442856033807,16.0,COMPLETE
42,30.33560256958008,2026-10-06 22:02:35.218843,2026-10-06 22:55:17.050303,0 days 00:52:41.831460,L2,0.0004237773443016983,112,4.0,2,AdamW,192.0,cosine,0.0003773812628010061,16.0,COMPLETE
43,29.167847442626954,2026-10-06 22:55:17.176067,2026-10-06 23:15:18.483461,0 days 00:20:01.307394,L2,0.0003978595166178367,112,4.0,2,AdamW,192.0,cosine,0.0004252955390669881,16.0,PRUNED
44,27.341318130493164,2026-10-06 23:15:18.640156,2026-10-06 23:21:35.031510,0 days 00:06:16.391354,L2,0.00034075749976574974,112,4.0,4,AdamW,192.0,cosine,0.000672128220989417,12.0,PRUNED
45,28.301869583129882,2026-10-06 23:21:35.145821,2026-10-06 23:27:53.013480,0 days 00:06:17.867659,L2,0.00022544357216722156,120,4.0,2,AdamW,160.0,step,6.085507755293418e-05,16.0,PRUNED
46,30.286539840698243,2026-10-06 23:27:53.131522,2026-10-07 00:15:30.502693,0 days 00:47:37.371171,L2,0.00040510924988948715,112,2.0,2,AdamW,192.0,cosine,0.0002488302979994541,16.0,COMPLETE
47,27.646015167236328,2026-10-07 00:15:30.641221,2026-10-07 00:21:11.123358,0 days 00:05:40.482137,L1,0.00026758545318869526,112,2.0,8,ADAM,192.0,cosine,0.0002861560081915687,16.0,PRUNED
48,,2026-10-07 00:21:11.246451,2026-10-07 00:21:11.541885,0 days 00:00:00.295434,,,120,,16,,,,,,PRUNED
49,28.404331588745116,2026-10-07 00:21:11.659640,2026-10-07 00:26:58.054407,0 days 00:05:46.394767,L2,0.0004149447663536581,120,2.0,2,AdamW,192.0,cosine,0.0004690910113882192,16.0,PRUNED
