number,value,datetime_start,datetime_complete,duration,params_loss,params_lr,params_n_feats,params_num_blocks,params_num_heads,params_optimizer,params_patch_size,params_scheduler,params_weight_decay,params_window_size,state
0,27.724370574951173,2026-10-05 21:35:04.131954,2026-10-05 22:24:51.189348,0 days 00:49:47.057394,Charbonnier,3.135775732257744e-05,88,3.0,2,ADAM,192.0,step,1.2562773503807034e-05,16.0,COMPLETE
1,28.048748016357422,2026-10-05 22:24:51.321884,2026-10-05 23:12:15.431681,0 days 00:47:24.109797,L2,3.385226783451975e-05,96,2.0,2,AdamW,160.0,step,3.632486956676606e-05,12.0,COMPLETE
2,27.941124725341798,2026-10-05 23:12:15.564990,2026-10-06 00:01:51.894227,0 days 00:49:36.329237,Huber,0.00020512599422151375,96,2.0,4,AdamW,224.0,step,3.9459088110999995e-06,16.0,COMPLETE
3,29.069482040405273,2026-10-06 00:01:52.058193,2026-10-06 00:56:10.978056,0 days 00:54:18.919863,Charbonnier,0.00020410334065257057,64,4.0,2,AdamW,128.0,cosine,3.0296104428212496e-05,12.0,COMPLETE
4,30.186024856567382,2026-10-06 00:56:11.113444,2026-10-06 01:47:55.277294,0 days 00:51:44.163850,L2,0.00032842103509117315,96,4.0,2,AdamW,192.0,cosine,4.149795789891592e-05,8.0,COMPLETE
5,28.215488815307616,2026-10-06 01:47:55.386015,2026-10-06 02:35:37.031759,0 days 00:47:41.645744,L2,6.995363653959081e-05,120,2.0,2,AdamW,128.0,step,7.991621920384356e-06,16.0,COMPLETE
6,27.87568359375,2026-10-06 02:35:37.172223,2026-10-06 03:23:39.905911,0 days 00:48:02.733688,Huber,3.5074840789944696e-05,80,2.0,4,ADAM,160.0,fixed,3.627066608804412e-06,12.0,COMPLETE
7,27.890755462646485,2026-10-06 03:23:40.054770,2026-10-06 04:16:55.769873,0 days 00:53:15.715103,L1,1.4393910893270896e-05,64,4.0,4,AdamW,160.0,fixed,0.0004916400722913762,12.0,COMPLETE
8,30.22168846130371,2026-10-06 04:16:55.924113,2026-10-06 05:07:59.095782,0 days 00:51:03.171669,L2,0.0001621702307943825,128,3.0,16,AdamW,192.0,fixed,5.149288946949016e-06,8.0,COMPLETE
9,29.590761947631837,2026-10-06 05:07:59.223413,2026-10-06 05:55:43.997285,0 days 00:47:44.773872,L2,0.00012492175283159113,80,2.0,8,AdamW,160.0,cosine,3.398850311078454e-06,8.0,COMPLETE
10,29.468695068359374,2026-10-06 05:55:44.152444,2026-10-06 06:45:24.114193,0 days 00:49:39.961749,L1,0.00041890886041651685,128,3.0,16,ADAM,192.0,fixed,1.0887633888418055e-06,8.0,COMPLETE
11,30.304429626464845,2026-10-06 06:45:24.257112,2026-10-06 07:37:45.422633,0 days 00:52:21.165521,L2,0.00039043642911832337,112,4.0,16,AdamW,192.0,cosine,0.00018341264676154025,8.0,COMPLETE
12,30.062166595458983,2026-10-06 07:37:45.561203,2026-10-06 08:27:49.589463,0 days 00:50:04.028260,L2,0.0001168099520960155,112,3.0,16,AdamW,192.0,fixed,0.00029693796441449666,8.0,COMPLETE
13,30.094222259521484,2026-10-06 08:27:49.697366,2026-10-06 09:20:10.760718,0 days 00:52:21.063352,L2,0.0004885313857123718,112,4.0,16,AdamW,192.0,cosine,0.00015521255515224666,8.0,COMPLETE
15,30.02591896057129,2026-10-06 09:27:08.841199,2026-10-06 10:17:05.984193,0 days 00:49:57.142994,L2,0.00011727637309464825,112,3.0,16,AdamW,192.0,fixed,0.0006924920297434953,8.0,COMPLETE
19,29.635773849487304,2026-10-06 10:23:28.869678,2026-10-06 11:13:33.271722,0 days 00:50:04.402044,L1,0.0002677695951664379,128,3.0,16,AdamW,192.0,fixed,1.2029971025649774e-06,8.0,COMPLETE
21,30.2387939453125,2026-10-06 11:20:04.343219,2026-10-06 12:12:53.624510,0 days 00:52:49.281291,L2,0.0003531093697089976,104,4.0,2,AdamW,192.0,cosine,4.706647153281607e-05,8.0,COMPLETE
22,30.25742835998535,2026-10-06 12:12:53.766624,2026-10-06 13:05:24.618853,0 days 00:52:30.852229,L2,0.0003494423976183291,104,4.0,2,AdamW,192.0,cosine,0.00017413914472238815,8.0,COMPLETE
23,30.235258865356446,2026-10-06 13:05:24.770226,2026-10-06 13:57:57.001830,0 days 00:52:32.231604,L2,0.0003149312851376857,104,4.0,2,AdamW,192.0,cosine,0.00021596018238130191,8.0,COMPLETE
24,30.189668273925783,2026-10-06 13:57:57.113027,2026-10-06 14:50:32.567571,0 days 00:52:35.454544,L2,0.0004045397926452827,88,4.0,2,AdamW,128.0,cosine,6.87863246970207e-05,8.0,COMPLETE
25,30.25093002319336,2026-10-06 14:50:32.699468,2026-10-06 15:43:29.321193,0 days 00:52:56.621725,L2,0.0004738149530118309,104,4.0,2,AdamW,192.0,cosine,0.00034051520916194097,16.0,COMPLETE
26,30.367637634277344,2026-10-06 15:43:29.612372,2026-10-06 16:36:30.189621,0 days 00:53:00.577249,L2,0.00046570041311233334,112,4.0,2,AdamW,192.0,cosine,0.0009217288293720986,16.0,COMPLETE
27,30.146025085449217,2026-10-06 16:36:30.302038,2026-10-06 17:29:18.087501,0 days 00:52:47.785463,L2,0.00027195952978200516,112,4.0,2,AdamW,192.0,cosine,0.0008548541746538431,16.0,COMPLETE
31,30.255953216552733,2026-10-06 17:49:34.708253,2026-10-06 18:42:23.520674,0 days 00:52:48.812421,L2,0.0004617673582490247,104,4.0,2,AdamW,192.0,cosine,0.00035195057552866196,16.0,COMPLETE
33,30.161217498779298,2026-10-06 18:48:46.135522,2026-10-06 20:09:50.044487,0 days 01:21:03.908965,L2,0.0003716854712472733,96,4.0,2,AdamW,192.0,cosine,0.000538316254307848,16.0,COMPLETE
41,30.27004051208496,2026-10-06 21:09:56.502407,2026-10-06 22:02:35.065704,0 days 00:52:38.563297,L2,0.0004934016339890112,104,4.0,2,AdamW,192.0,cosine,0.00034881442856033807,16.0,COMPLETE
42,30.33560256958008,2026-10-06 22:02:35.218843,2026-10-06 22:55:17.050303,0 days 00:52:41.831460,L2,0.0004237773443016983,112,4.0,2,AdamW,192.0,cosine,0.0003773812628010061,16.0,COMPLETE
46,30.286539840698243,2026-10-06 23:27:53.131522,2026-10-07 00:15:30.502693,0 days 00:47:37.371171,L2,0.00040510924988948715,112,2.0,2,AdamW,192.0,cosine,0.0002488302979994541,16.0,COMPLETE
