number,value,datetime_start,datetime_complete,duration,params_depth,params_loss,params_lr,params_mlp_ratio,params_n_feats,params_num_heads,params_optimizer,params_patch_size,params_scheduler,params_weight_decay,params_window_size,state
0,26.837839126586914,2026-09-26 20:32:07.840677,2026-09-26 22:22:53.625411,0 days 01:50:45.784734,1,Huber,1.7258215396625005e-05,2.25,56,2,ADAM,192,step,7.523742884534855e-06,16,COMPLETE
1,26.01563720703125,2026-09-26 22:22:53.795404,2026-09-27 00:44:00.285786,0 days 02:21:06.490382,2,Huber,2.7520696850790512e-05,1.5,56,4,ADAM,192,cosine,9.717775305059631e-05,16,COMPLETE
2,28.65984687805176,2026-09-27 00:44:00.459656,2026-09-27 03:21:41.403633,0 days 02:37:40.943977,3,Charbonnier,0.0002306261812167793,2.0,48,4,AdamW,128,step,1.6736010167825795e-06,12,COMPLETE
3,27.24328155517578,2026-09-27 03:21:41.544834,2026-09-27 06:09:59.339600,0 days 02:48:17.794766,3,Charbonnier,1.596566588617374e-05,1.5,96,2,ADAM,192,step,0.00013795402040204168,16,COMPLETE
4,26.10691719055176,2026-09-27 06:09:59.480500,2026-09-27 08:32:25.844109,0 days 02:22:26.363609,2,Huber,0.00023603276001278101,1.5,80,4,ADAM,128,cosine,7.947147424653752e-05,8,COMPLETE
5,28.000079727172853,2026-09-27 08:32:25.988488,2026-09-27 10:48:32.702967,0 days 02:16:06.714479,2,Charbonnier,7.610438922351127e-05,1.5,88,8,ADAM,192,fixed,0.00012854549964879015,12,COMPLETE
6,28.01357231140137,2026-09-27 10:48:32.863102,2026-09-27 13:06:26.315512,0 days 02:17:53.452410,2,Charbonnier,0.00017267033554444337,2.25,56,2,ADAM,128,step,1.268672126210486e-05,8,COMPLETE
7,30.67520637512207,2026-09-27 13:06:26.439107,2026-09-27 16:00:12.162716,0 days 02:53:45.723609,3,L1,0.0003724146189492819,2.0,72,2,AdamW,128,cosine,0.00042856634196503465,8,COMPLETE
8,27.812367630004882,2026-09-27 16:00:12.288886,2026-09-27 18:38:08.652313,0 days 02:37:56.363427,2,Charbonnier,1.0366341572924706e-05,2.5,48,4,AdamW,128,fixed,2.015647705936503e-06,16,COMPLETE
9,28.017699432373046,2026-09-27 18:38:08.800869,2026-09-27 22:53:29.208331,0 days 04:15:20.407462,3,Charbonnier,0.00032776331220237226,1.75,72,8,ADAM,160,fixed,7.823766455329715e-05,16,COMPLETE
10,30.042243576049806,2026-09-27 22:53:29.357776,2026-09-28 00:46:52.957447,0 days 01:53:23.599671,1,L1,0.0004852822449408544,2.0,32,2,AdamW,160,cosine,0.0009474948691215786,8,COMPLETE
11,30.10458297729492,2026-09-28 00:46:53.104488,2026-09-28 02:40:45.273698,0 days 01:53:52.169210,1,L1,0.00044508368974180597,2.0,32,2,AdamW,160,cosine,0.0009912574829445237,8,COMPLETE
12,27.07770652770996,2026-09-28 02:40:45.431952,2026-09-28 02:54:33.655253,0 days 00:13:48.223301,1,L1,7.782298572661173e-05,2.25,32,2,AdamW,160,cosine,0.0007411778350862539,8,PRUNED
13,30.14191131591797,2026-09-28 02:54:33.779061,2026-09-28 04:48:04.832053,0 days 01:53:31.052992,1,L1,0.00013447516941392405,1.75,72,2,AdamW,160,cosine,0.00039857502708466434,8,COMPLETE
14,30.266737365722655,2026-09-28 04:48:04.973554,2026-09-28 07:45:37.310560,0 days 02:57:32.337006,3,L2,0.000123410998262688,1.75,72,2,AdamW,128,cosine,0.000323748075129171,8,COMPLETE
15,29.638575744628906,2026-09-28 07:45:37.455464,2026-09-28 10:44:10.882752,0 days 02:58:33.427288,3,L2,4.641719714234165e-05,1.75,72,2,AdamW,128,cosine,0.0002554391956428337,8,COMPLETE
16,30.41717414855957,2026-09-28 10:44:11.036581,2026-09-28 13:32:34.136389,0 days 02:48:23.099808,3,L2,0.00011937825087610175,1.75,88,8,AdamW,128,cosine,3.3838389059127976e-05,12,COMPLETE
17,30.077404403686522,2026-09-28 13:32:34.289979,2026-09-28 16:25:22.257349,0 days 02:52:47.967370,3,L2,5.7317561367862616e-05,2.5,96,8,AdamW,128,cosine,2.7419500068863e-05,12,COMPLETE
18,30.40658302307129,2026-09-28 16:25:22.383501,2026-09-28 19:11:46.895408,0 days 02:46:24.511907,3,L2,0.0001151329891615525,2.0,88,8,AdamW,128,cosine,4.81939782427194e-06,12,COMPLETE
19,30.47558250427246,2026-09-28 19:11:47.023068,2026-09-28 21:52:59.971258,0 days 02:41:12.948190,3,L2,0.00029196391396823384,1.75,88,8,AdamW,128,fixed,3.5201102365368356e-05,12,COMPLETE
20,30.561820220947265,2026-09-28 21:53:00.095643,2026-09-29 00:30:55.589259,0 days 02:37:55.493616,3,L1,0.0003441151929641435,2.0,80,8,AdamW,128,fixed,3.42883585507601e-05,12,COMPLETE
21,30.61565399169922,2026-09-29 00:30:55.719289,2026-09-29 03:09:43.491280,0 days 02:38:47.771991,3,L1,0.0003035006991210817,2.0,80,8,AdamW,128,fixed,3.350191404696732e-05,12,COMPLETE
22,30.601003646850586,2026-09-29 03:09:43.621123,2026-09-29 05:51:58.018251,0 days 02:42:14.397128,3,L1,0.00037712493987261973,2.0,80,8,AdamW,128,fixed,1.8141707277330932e-05,12,COMPLETE
23,30.498310852050782,2026-09-29 05:51:58.159962,2026-09-29 08:31:05.643248,0 days 02:39:07.483286,3,L1,0.00022463014467643606,2.25,64,8,AdamW,128,fixed,1.3378798657696016e-05,12,COMPLETE
24,30.52768745422363,2026-09-29 08:31:05.807870,2026-09-29 10:41:07.402674,0 days 02:10:01.594804,2,L1,0.0003818588718189724,2.0,80,8,AdamW,128,fixed,3.3813711084187152e-06,12,COMPLETE
25,30.47917823791504,2026-09-29 10:41:07.564126,2026-09-29 13:20:55.405010,0 days 02:39:47.840884,3,L1,0.00019290296558093737,2.25,64,8,AdamW,128,fixed,1.3991789648063399e-05,12,COMPLETE
26,30.56425323486328,2026-09-29 13:20:55.532162,2026-09-29 15:36:46.599352,0 days 02:15:51.067190,2,L1,0.0004910096910182906,2.0,80,8,AdamW,128,fixed,5.451388134282952e-05,12,COMPLETE
27,29.306807708740234,2026-09-29 15:36:46.727725,2026-09-29 17:22:44.544639,0 days 01:45:57.816914,3,L1,0.000280397621705019,2.0,64,8,AdamW,128,fixed,0.00018294805036281594,12,PRUNED
28,30.67307929992676,2026-09-29 17:22:44.681661,2026-09-29 20:26:28.269079,0 days 03:03:43.587418,3,L1,0.00015000484409693807,2.25,80,4,AdamW,192,fixed,1.0967548455456036e-06,12,COMPLETE
29,28.58205680847168,2026-09-29 20:26:28.385727,2026-09-29 20:53:37.332365,0 days 00:27:08.946638,2,Huber,0.00017235695524652598,2.5,72,4,AdamW,192,step,6.532156390368981e-06,8,PRUNED
30,,2026-09-29 20:53:37.460119,,,3,L1,8.984954143157404e-05,2.25,96,4,AdamW,192,fixed,1.1477791387748644e-06,16,RUNNING
31,28.080169677734375,2026-09-30 09:43:07.849602,2026-09-30 10:07:21.198615,0 days 00:24:13.349013,3,L1,9.151103536910664e-05,2.25,96,4,AdamW,192,fixed,1.114937041008133e-06,16,PRUNED
32,30.668279266357423,2026-09-30 10:07:21.368241,2026-09-30 13:07:17.361356,0 days 02:59:55.993115,3,L1,0.00037192261813974074,2.25,80,4,AdamW,192,fixed,0.0005164287135341416,12,COMPLETE
33,30.804401016235353,2026-09-30 13:07:17.503080,2026-09-30 16:05:47.702725,0 days 02:58:30.199645,3,L1,0.0002585883829298715,2.25,80,4,AdamW,192,fixed,0.0004119537600595475,12,COMPLETE
34,30.74985580444336,2026-09-30 16:05:47.828655,2026-09-30 19:05:27.765022,0 days 02:59:39.936367,3,L1,0.00015450190165911104,2.25,88,4,AdamW,192,fixed,0.0005021342196169607,12,COMPLETE
35,20.62313461303711,2026-09-30 19:05:27.868227,2026-09-30 19:25:33.907080,0 days 00:20:06.038853,3,Huber,0.00015084175003300877,2.5,88,4,ADAM,192,step,0.000583522311520618,12,PRUNED
36,30.772039031982423,2026-09-30 19:25:34.066165,2026-09-30 22:33:04.254302,0 days 03:07:30.188137,3,L1,0.00022173707043404408,2.25,88,4,AdamW,192,fixed,0.00020004698877489557,16,COMPLETE
37,27.6286979675293,2026-09-30 22:33:04.386630,2026-09-30 22:54:16.117811,0 days 00:21:11.731181,3,L1,0.00022341438005198995,2.25,96,4,ADAM,192,fixed,0.00022821959166843453,16,PRUNED
38,27.683248138427736,2026-09-30 22:54:16.261006,2026-09-30 23:12:12.405656,0 days 00:17:56.144650,2,Huber,3.5160624970107914e-05,2.25,88,4,AdamW,192,step,0.00040349430100709323,16,PRUNED
39,27.498556900024415,2026-09-30 23:12:12.560129,2026-09-30 23:32:21.188001,0 days 00:20:08.627872,3,L1,0.0002583825647916291,2.5,56,4,ADAM,192,fixed,0.0001413049023281872,16,PRUNED
40,30.641203689575196,2026-09-30 23:32:21.341392,2026-10-01 02:01:57.858821,0 days 02:29:36.517429,2,L1,0.00019677351963536967,2.25,88,4,AdamW,192,fixed,0.000607473022571018,16,COMPLETE
41,29.899132537841798,2026-10-01 02:01:57.987023,2026-10-01 03:27:02.978139,0 days 01:25:04.991116,2,L1,0.00024616547407481403,2.5,96,4,AdamW,192,step,9.778571036047936e-05,16,PRUNED
42,27.090605163574217,2026-10-01 03:27:03.091122,2026-10-01 03:47:56.752072,0 days 00:20:53.660950,3,L1,9.48798017854286e-05,2.25,72,4,AdamW,192,fixed,0.00030523079186364803,12,PRUNED
43,30.643080139160155,2026-10-01 03:47:56.880341,2026-10-01 06:42:33.060002,0 days 02:54:36.179661,3,L1,0.00014946053588777653,2.25,80,4,AdamW,192,fixed,0.00018760703874877587,8,COMPLETE
44,30.748842239379883,2026-10-01 06:42:33.161227,2026-10-01 09:46:01.876110,0 days 03:03:28.714883,3,Charbonnier,0.0001742996594780831,2.25,80,4,AdamW,192,fixed,0.00042910743011731326,16,COMPLETE
45,30.762959671020507,2026-10-01 09:46:01.994495,2026-10-01 12:54:33.059344,0 days 03:08:31.064849,3,Charbonnier,0.00020145590805278606,2.25,88,4,AdamW,192,fixed,0.0004826730542923709,16,COMPLETE
46,27.3092041015625,2026-10-01 12:54:33.186697,2026-10-01 13:15:46.717107,0 days 00:21:13.530410,3,Charbonnier,0.00018165319051189304,2.25,96,4,ADAM,192,fixed,0.000691817784310805,16,PRUNED
47,28.26994209289551,2026-10-01 13:15:46.820671,2026-10-01 13:42:12.735013,0 days 00:26:25.914342,3,Charbonnier,0.00010081564795375833,2.5,88,4,AdamW,192,fixed,0.0004248490605189343,16,PRUNED
48,27.95032157897949,2026-10-01 13:42:12.872011,2026-10-01 14:03:24.554570,0 days 00:21:11.682559,3,Charbonnier,0.0002108411940542825,2.25,48,4,AdamW,192,fixed,0.0008210839231836948,16,PRUNED
49,27.78661003112793,2026-10-01 14:03:24.678883,2026-10-01 14:26:04.984194,0 days 00:22:40.305311,3,Charbonnier,6.335970903213063e-05,2.5,88,4,AdamW,192,fixed,0.00031267746898285854,16,PRUNED
