number,value,datetime_start,datetime_complete,duration,params_loss,params_lr,params_n_feats,params_num_blocks,params_num_heads,params_optimizer,params_patch_size,params_scheduler,params_weight_decay,params_window_size,state
0,27.704689025878906,2026-10-01 20:49:44.134576,2026-10-01 21:39:38.099261,0 days 00:49:53.964685,Charbonnier,3.135775732257744e-05,88,3.0,2,ADAM,192.0,step,1.2562773503807034e-05,16.0,COMPLETE
1,28.064569091796876,2026-10-01 21:39:38.206184,2026-10-01 22:23:32.402008,0 days 00:43:54.195824,L2,3.385226783451975e-05,96,2.0,2,AdamW,160.0,step,3.632486956676606e-05,12.0,COMPLETE
2,28.082281494140624,2026-10-01 22:23:32.495713,2026-10-01 23:15:47.019664,0 days 00:52:14.523951,Huber,0.00020512599422151375,96,2.0,4,AdamW,224.0,step,3.9459088110999995e-06,16.0,COMPLETE
3,29.60862808227539,2026-10-01 23:15:47.175651,2026-10-02 00:07:52.294311,0 days 00:52:05.118660,Charbonnier,0.00020410334065257057,64,4.0,2,AdamW,128.0,cosine,3.0296104428212496e-05,12.0,COMPLETE
4,30.423180770874023,2026-10-02 00:07:52.395071,2026-10-02 00:59:25.562232,0 days 00:51:33.167161,L2,0.00032842103509117315,96,4.0,2,AdamW,192.0,cosine,4.149795789891592e-05,8.0,COMPLETE
5,28.120180130004883,2026-10-02 00:59:25.690631,2026-10-02 01:43:32.539731,0 days 00:44:06.849100,L2,6.995363653959081e-05,120,2.0,2,AdamW,128.0,step,7.991621920384356e-06,16.0,COMPLETE
6,27.866941070556642,2026-10-02 01:43:32.648484,2026-10-02 02:28:47.387142,0 days 00:45:14.738658,Huber,3.5074840789944696e-05,80,2.0,4,ADAM,160.0,fixed,3.627066608804412e-06,12.0,COMPLETE
7,27.851255416870117,2026-10-02 02:28:47.528081,2026-10-02 03:22:22.298725,0 days 00:53:34.770644,L1,1.4393910893270896e-05,64,4.0,4,AdamW,160.0,fixed,0.0004916400722913762,12.0,COMPLETE
8,30.292589950561524,2026-10-02 03:22:22.459632,2026-10-02 04:13:18.839601,0 days 00:50:56.379969,L2,0.0001621702307943825,128,3.0,16,AdamW,192.0,fixed,5.149288946949016e-06,8.0,COMPLETE
9,29.393768310546875,2026-10-02 04:13:19.011903,2026-10-02 04:57:25.646141,0 days 00:44:06.634238,L2,0.00012492175283159113,80,2.0,8,AdamW,160.0,cosine,3.398850311078454e-06,8.0,COMPLETE
10,27.4937686920166,2026-10-02 04:57:25.737290,2026-10-02 05:04:00.058087,0 days 00:06:34.320797,L1,0.0004443999187908329,112,4.0,8,ADAM,192.0,cosine,0.00029545417081494217,8.0,PRUNED
11,30.48270034790039,2026-10-02 05:04:00.179307,2026-10-02 05:54:53.701187,0 days 00:50:53.521880,L2,0.00039043642911832337,128,3.0,16,AdamW,192.0,fixed,1.062237111178906e-06,8.0,COMPLETE
12,30.417984390258788,2026-10-02 05:54:53.845735,2026-10-02 06:43:37.034578,0 days 00:48:43.188843,L2,0.00047886211308877753,112,3.0,16,AdamW,192.0,fixed,1.1872456968442773e-06,8.0,COMPLETE
13,30.41100616455078,2026-10-02 06:43:37.154282,2026-10-02 07:40:20.880392,0 days 00:56:43.726110,L2,0.00032738188339909727,112,4.0,16,AdamW,192.0,cosine,0.00012592371637063423,8.0,COMPLETE
14,,2026-10-02 07:40:21.069149,2026-10-02 07:40:21.369848,0 days 00:00:00.300699,,,104,,16,,,,,,PRUNED
15,27.568979263305664,2026-10-02 07:40:21.473329,2026-10-02 07:46:55.152256,0 days 00:06:33.678927,L2,9.202456961626287e-05,128,3.0,2,ADAM,224.0,cosine,5.402331326939969e-05,8.0,PRUNED
16,30.207389450073244,2026-10-02 07:46:55.267315,2026-10-02 08:34:54.331847,0 days 00:47:59.064532,L2,0.0002568955904433671,80,3.0,16,AdamW,192.0,fixed,1.2068605164306055e-06,8.0,COMPLETE
17,30.372665405273438,2026-10-02 08:34:54.465978,2026-10-02 09:29:10.333981,0 days 00:54:15.868003,Huber,0.00033316695271877516,104,4.0,8,AdamW,192.0,cosine,0.00010320741535319875,8.0,COMPLETE
18,,2026-10-02 09:29:10.492452,2026-10-02 09:29:10.792933,0 days 00:00:00.300481,,,88,,16,,,,,,PRUNED
19,27.706599044799805,2026-10-02 09:29:10.899047,2026-10-02 09:34:58.367387,0 days 00:05:47.468340,L1,6.478781561999604e-05,120,3.0,2,AdamW,192.0,fixed,1.595506996451526e-05,8.0,PRUNED
20,,2026-10-02 09:34:58.494644,2026-10-02 09:34:58.785860,0 days 00:00:00.291216,,,104,,16,,,,,,PRUNED
21,,2026-10-02 09:34:58.895547,2026-10-02 09:34:59.178821,0 days 00:00:00.283274,,,120,,16,,,,,,PRUNED
22,30.41156883239746,2026-10-02 09:34:59.311701,2026-10-02 10:23:42.018298,0 days 00:48:42.706597,L2,0.00044682546304137963,112,3.0,16,AdamW,192.0,fixed,1.0835847514722128e-06,8.0,COMPLETE
23,30.429109191894533,2026-10-02 10:23:42.181117,2026-10-02 11:14:34.143228,0 days 00:50:51.962111,L2,0.00045453307610631886,128,3.0,16,AdamW,192.0,fixed,1.8422566324617043e-06,8.0,COMPLETE
24,30.303759384155274,2026-10-02 11:14:34.316189,2026-10-02 12:05:43.001853,0 days 00:51:08.685664,L2,0.00029215389303261527,128,3.0,16,AdamW,192.0,fixed,2.127097060021275e-06,8.0,COMPLETE
25,27.930836868286132,2026-10-02 12:05:43.143539,2026-10-02 12:12:17.172650,0 days 00:06:34.029111,Charbonnier,0.00017465716525812757,120,3.0,2,AdamW,224.0,fixed,0.000995956756696024,8.0,PRUNED
26,28.0197395324707,2026-10-02 12:12:17.297960,2026-10-02 12:18:27.870143,0 days 00:06:10.572183,L2,0.00012350313525832284,128,4.0,8,AdamW,128.0,fixed,2.1309115839790405e-06,8.0,PRUNED
27,27.957896423339843,2026-10-02 12:18:28.031258,2026-10-02 12:25:22.838344,0 days 00:06:54.807086,L2,0.00032228906160864084,88,4.0,4,ADAM,192.0,cosine,1.8025489087550642e-05,16.0,PRUNED
28,,2026-10-02 12:25:22.964176,2026-10-02 12:25:23.297869,0 days 00:00:00.333693,,,72,,16,,,,,,PRUNED
29,29.714397430419922,2026-10-02 12:25:23.409832,2026-10-02 12:42:15.737859,0 days 00:16:52.328027,L2,0.0004670389376235531,96,3.0,2,AdamW,192.0,fixed,7.39962687823994e-06,8.0,PRUNED
30,29.70786056518555,2026-10-02 12:42:15.872399,2026-10-02 12:59:20.983151,0 days 00:17:05.110752,L2,0.00024553712630705937,104,3.0,2,AdamW,192.0,cosine,8.465470592889902e-05,8.0,PRUNED
31,30.427684783935547,2026-10-02 12:59:21.148583,2026-10-02 13:48:05.413671,0 days 00:48:44.265088,L2,0.0004500614580930379,112,3.0,16,AdamW,192.0,fixed,1.6011175228871711e-06,8.0,COMPLETE
32,,2026-10-02 13:48:05.560369,2026-10-02 13:48:05.876413,0 days 00:00:00.316044,,,120,,16,,,,,,PRUNED
33,30.47668342590332,2026-10-02 13:48:05.997309,2026-10-02 14:39:04.662146,0 days 00:50:58.664837,L2,0.0003637630107733973,128,3.0,16,AdamW,192.0,fixed,1.9833699279890556e-06,8.0,COMPLETE
34,30.437287902832033,2026-10-02 14:39:04.815324,2026-10-02 15:30:27.901486,0 days 00:51:23.086162,L2,0.00038305188433243625,128,3.0,16,AdamW,192.0,fixed,2.1234267973074115e-06,8.0,COMPLETE
35,30.438794326782226,2026-10-02 15:30:28.039361,2026-10-02 16:21:33.563565,0 days 00:51:05.524204,L2,0.00036897881843497697,128,3.0,16,AdamW,192.0,fixed,2.35682967808874e-06,8.0,COMPLETE
36,27.654392623901366,2026-10-02 16:21:33.887496,2026-10-02 16:32:24.831767,0 days 00:10:50.944271,Charbonnier,5.024956211920124e-05,128,3.0,16,ADAM,192.0,fixed,2.4642011049188277e-06,16.0,PRUNED
37,,2026-10-02 16:32:24.938845,2026-10-02 16:32:25.198287,0 days 00:00:00.259442,,,120,,16,,,,,,PRUNED
38,27.408942413330077,2026-10-02 16:32:25.298140,2026-10-02 16:38:10.132728,0 days 00:05:44.834588,L1,1.728635961510515e-05,128,3.0,4,AdamW,192.0,fixed,6.661183805049073e-06,8.0,PRUNED
39,,2026-10-02 16:38:10.248250,2026-10-02 16:38:10.522643,0 days 00:00:00.274393,,,120,,16,,,,,,PRUNED
40,27.894881820678712,2026-10-02 16:38:10.624167,2026-10-02 16:43:53.855684,0 days 00:05:43.231517,Huber,0.00023015778731160636,128,2.0,16,AdamW,128.0,step,2.8295069921460786e-06,12.0,PRUNED
41,30.420796585083007,2026-10-02 16:43:53.981369,2026-10-02 17:43:01.347749,0 days 00:59:07.366380,L2,0.0003653632345547693,128,3.0,16,AdamW,192.0,fixed,1.6413445115520227e-06,8.0,COMPLETE
42,30.399427032470705,2026-10-02 17:43:01.464453,2026-10-02 18:40:35.629579,0 days 00:57:34.165126,L2,0.00038246607160482226,128,3.0,16,AdamW,192.0,fixed,1.7636125371409706e-06,8.0,COMPLETE
43,,2026-10-02 18:40:35.767515,2026-10-02 18:40:36.105879,0 days 00:00:00.338364,,,120,,16,,,,,,PRUNED
44,30.462548446655273,2026-10-02 18:40:36.201303,2026-10-02 19:49:06.727036,0 days 01:08:30.525733,L2,0.0002689976074011372,128,3.0,16,AdamW,224.0,fixed,4.654540334856687e-06,8.0,COMPLETE
45,27.540649032592775,2026-10-02 19:49:06.894242,2026-10-02 19:55:42.191096,0 days 00:06:35.296854,Charbonnier,0.00019710391366021518,120,3.0,4,AdamW,224.0,fixed,5.2086490562780145e-06,8.0,PRUNED
46,30.46813545227051,2026-10-02 19:55:42.329062,2026-10-02 22:16:15.921683,0 days 02:20:33.592621,L2,0.00027551023144793685,128,3.0,16,AdamW,224.0,fixed,1.0115445640788052e-06,16.0,COMPLETE
47,29.033996200561525,2026-10-02 22:16:16.069481,2026-10-02 22:26:31.224545,0 days 00:10:15.155064,L2,0.00025946007676345344,120,2.0,8,AdamW,224.0,step,1.090342994476747e-06,16.0,PRUNED
48,28.07300224304199,2026-10-02 22:26:31.344740,2026-10-02 22:42:40.039652,0 days 00:16:08.694912,L2,0.0001327144517273609,112,3.0,16,AdamW,224.0,fixed,4.34948061497917e-06,16.0,PRUNED
49,27.74020118713379,2026-10-02 22:42:40.159367,2026-10-02 22:59:32.434595,0 days 00:16:52.275228,Huber,0.0001604840796675329,128,3.0,16,ADAM,224.0,step,1.0389603233890338e-05,16.0,PRUNED
