number,value,datetime_start,datetime_complete,duration,params_loss,params_lr,params_n_feats,params_num_blocks,params_num_heads,params_optimizer,params_patch_size,params_scheduler,params_weight_decay,params_window_size,state
0,29.29343376159668,2026-09-23 01:14:00.591265,2026-09-23 02:00:57.384962,0 days 00:46:56.793697,L2,4.192159350410976e-05,88,2,2,AdamW,192,cosine,2.334586407601622e-05,12,COMPLETE
1,28.13686599731445,2026-09-23 02:00:57.515361,2026-09-23 02:51:07.600171,0 days 00:50:10.084810,L2,8.488762161408708e-05,120,3,8,ADAM,128,step,3.5856126103453987e-06,16,COMPLETE
2,30.75124855041504,2026-09-23 02:51:07.725035,2026-09-23 04:18:18.043830,0 days 01:27:10.318795,L1,0.0002429095036825497,128,4,4,AdamW,224,cosine,0.00013199942261535007,12,COMPLETE
3,27.879081344604494,2026-09-23 04:18:18.183851,2026-09-23 05:34:19.285457,0 days 01:16:01.101606,L1,1.1045524260304719e-05,112,4,2,ADAM,256,cosine,2.107047280657824e-06,8,COMPLETE
4,27.090465545654297,2026-09-23 05:34:19.429012,2026-09-23 06:44:26.337051,0 days 01:10:06.908039,Charbonnier,1.5380658115982014e-05,64,2,16,AdamW,224,step,4.828424974818325e-06,12,COMPLETE
5,27.81993522644043,2026-09-23 06:44:26.477331,2026-09-23 07:35:17.146531,0 days 00:50:50.669200,Charbonnier,1.223096868463762e-05,88,3,4,ADAM,128,cosine,6.85392570885306e-06,16,COMPLETE
6,29.51193733215332,2026-09-23 07:35:17.320683,2026-09-23 08:23:45.905892,0 days 00:48:28.585209,L2,2.425546071605744e-05,128,2,16,AdamW,128,fixed,8.62022042601805e-05,12,COMPLETE
7,24.869105529785156,2026-09-23 08:23:46.020585,2026-09-23 09:14:38.631411,0 days 00:50:52.610826,Huber,0.0003214646526467849,72,3,8,ADAM,192,cosine,0.00021858816162324157,12,COMPLETE
8,28.04503974914551,2026-09-23 09:14:38.807661,2026-09-23 10:01:51.109989,0 days 00:47:12.302328,L1,4.214422962057283e-05,104,2,8,ADAM,192,cosine,6.24607368131809e-06,12,COMPLETE
9,30.495790481567383,2026-09-23 10:01:51.308664,2026-09-23 12:32:39.777421,0 days 02:30:48.468757,Huber,0.0004336720537130751,80,4,2,AdamW,160,fixed,0.00036226665947286665,12,COMPLETE
11,30.62513656616211,2026-09-23 21:52:35.885801,2026-09-23 23:03:56.497205,0 days 01:11:20.611404,L1,0.00018414355854512083,128,4,4,AdamW,224,fixed,0.00094861065051841,8,COMPLETE
12,30.60265655517578,2026-09-23 23:03:56.672702,2026-09-24 00:14:14.731031,0 days 01:10:18.058329,L1,0.00018425758122983738,128,4,4,AdamW,224,fixed,0.0008053792205311838,8,COMPLETE
13,30.58478202819824,2026-09-24 00:14:14.865973,2026-09-24 01:18:36.486627,0 days 01:04:21.620654,L1,0.00016647621216273062,112,4,4,AdamW,224,fixed,7.857007902672141e-05,8,COMPLETE
14,30.658678817749024,2026-09-24 01:18:36.648418,2026-09-24 02:28:52.033196,0 days 01:10:15.384778,L1,0.00019928885144256055,128,4,4,AdamW,224,fixed,0.0009728613904848122,8,COMPLETE
16,30.743851089477538,2026-09-24 02:36:14.196348,2026-09-24 04:08:12.379964,0 days 01:31:58.183616,L1,0.0002768010920909096,120,3,4,AdamW,256,cosine,2.322775435311717e-05,16,COMPLETE
17,30.827679443359376,2026-09-24 04:08:12.507467,2026-09-24 05:35:55.597490,0 days 01:27:43.090023,L1,0.0004970004815657692,112,3,4,AdamW,256,cosine,2.1766869852594235e-05,16,COMPLETE
18,30.777525329589842,2026-09-24 05:35:55.715860,2026-09-24 07:04:12.836903,0 days 01:28:17.121043,Huber,0.0004753932255674684,112,3,4,AdamW,256,cosine,5.038453173258293e-05,16,COMPLETE
19,30.68361015319824,2026-09-24 07:04:12.977496,2026-09-24 10:04:11.902841,0 days 02:59:58.925345,Huber,0.0004973765838658806,96,3,16,AdamW,256,cosine,3.958805846488694e-05,16,COMPLETE
21,30.696794509887695,2026-09-24 10:15:08.174452,2026-09-24 11:47:38.985633,0 days 01:32:30.811181,Huber,0.000368605318341998,112,3,4,AdamW,256,cosine,4.9702601310944586e-05,16,COMPLETE
22,30.601737594604494,2026-09-24 11:47:39.105313,2026-09-24 12:52:59.753243,0 days 01:05:20.647930,Charbonnier,0.00027046892043548624,120,3,4,AdamW,160,cosine,0.00010098378149062555,16,COMPLETE
23,30.808440017700196,2026-09-24 12:52:59.906833,2026-09-24 14:32:32.895816,0 days 01:39:32.988983,Huber,0.00044074129657933273,120,3,4,AdamW,256,cosine,1.3021781604548327e-05,16,COMPLETE
24,30.786093139648436,2026-09-24 14:32:33.057907,2026-09-24 16:08:07.111337,0 days 01:35:34.053430,Huber,0.0004347744193298306,112,3,4,AdamW,256,cosine,1.1984549147725869e-05,16,COMPLETE
28,30.690064239501954,2026-09-24 16:37:57.022686,2026-09-24 19:34:51.238582,0 days 02:56:54.215896,Huber,0.00037230957738784525,112,3,16,AdamW,256,cosine,2.3363840318276222e-05,16,COMPLETE
30,30.666290283203125,2026-09-24 19:43:24.529364,2026-09-24 20:38:01.946535,0 days 00:54:37.417171,L2,0.000493812970328662,88,2,2,AdamW,256,cosine,2.1981572529375656e-05,16,COMPLETE
32,30.720545959472656,2026-09-24 20:44:14.621655,2026-09-24 22:11:55.566451,0 days 01:27:40.944796,Huber,0.0003928298504406417,112,3,4,AdamW,256,cosine,5.226728438479308e-05,16,COMPLETE
33,30.72132339477539,2026-09-24 22:11:55.698438,2026-09-24 23:39:17.348235,0 days 01:27:21.649797,Huber,0.0004735968638880304,112,3,4,AdamW,256,cosine,3.449931629437068e-05,16,COMPLETE
40,30.717330551147462,2026-09-25 00:46:08.944985,2026-09-25 01:34:35.306091,0 days 00:48:26.361106,Huber,0.0004946006903139077,120,2,2,AdamW,192,cosine,1.791009517184805e-05,12,COMPLETE
42,30.867952728271483,2026-09-25 01:41:51.234138,2026-09-25 03:09:22.474376,0 days 01:27:31.240238,L1,0.00040181223544441785,128,4,4,AdamW,224,cosine,0.00018709724200887206,12,COMPLETE
