number,value,datetime_start,datetime_complete,duration,params_ffn_ratio,params_loss,params_lr,params_nf,params_num_blocks,params_num_heads,params_optimizer,params_patch_size,params_scheduler,params_weight_decay,params_window_size,state
0,28.685678482055664,2026-10-04 19:48:32.364777,2026-10-04 20:41:31.409375,0 days 00:52:59.044598,1.5,Huber,0.0002157696745589684,64,3,2,AdamW,128,step,3.972110727381911e-06,12,COMPLETE
1,27.63242301940918,2026-10-04 20:41:31.572317,2026-10-04 21:20:29.715070,0 days 00:38:58.142753,1.5,Charbonnier,0.0003946212980759095,80,2,8,ADAM,160,fixed,0.00048359527764659497,12,COMPLETE
2,27.293260955810545,2026-10-04 21:20:29.862575,2026-10-04 21:55:42.999973,0 days 00:35:13.137398,1.5,L2,1.5734685129393654e-05,88,2,2,ADAM,192,cosine,0.00038842777547031416,16,COMPLETE
3,27.70898895263672,2026-10-04 21:55:43.143011,2026-10-04 22:41:01.603462,0 days 00:45:18.460451,1.5,Charbonnier,4.979987773685082e-05,96,1,2,ADAM,128,step,0.0001847793417351927,12,COMPLETE
4,27.914238357543944,2026-10-04 22:41:01.791905,2026-10-04 23:24:47.107486,0 days 00:43:45.315581,1.0,L1,3.7462611558389604e-05,48,1,4,AdamW,128,cosine,0.0006741074265640696,4,COMPLETE
5,27.77197608947754,2026-10-04 23:24:47.285055,2026-10-04 23:59:29.419649,0 days 00:34:42.134594,1.5,L2,4.215533166949115e-05,64,2,4,ADAM,192,cosine,7.887102624766475e-05,4,COMPLETE
6,27.953706359863283,2026-10-04 23:59:29.599130,2026-10-05 00:33:42.671906,0 days 00:34:13.072776,2.0,L1,8.775452610882289e-05,96,1,8,ADAM,160,step,3.88107231640948e-05,16,COMPLETE
7,29.67362060546875,2026-10-05 00:33:42.799253,2026-10-05 01:21:55.010953,0 days 00:48:12.211700,1.0,L2,0.0001621702307943825,56,4,8,AdamW,160,fixed,5.149288946949016e-06,16,COMPLETE
8,20.932475662231447,2026-10-05 01:21:55.172224,2026-10-05 01:56:16.727372,0 days 00:34:21.555148,1.0,Huber,0.0004175380307518434,64,1,8,ADAM,160,cosine,0.0005553837526912237,4,COMPLETE
9,28.983310317993165,2026-10-05 01:56:16.887908,2026-10-05 02:51:46.917712,0 days 00:55:30.029804,2.0,L1,4.0809820330120634e-05,64,4,4,AdamW,128,fixed,7.599334001601099e-06,4,COMPLETE
10,30.161233139038085,2026-10-05 02:51:47.084816,2026-10-05 03:39:48.610456,0 days 00:48:01.525640,1.0,L2,0.0001286066697250772,128,4,8,AdamW,160,fixed,1.217404417807554e-06,8,COMPLETE
11,30.141926956176757,2026-10-05 03:39:48.752885,2026-10-05 04:26:55.196826,0 days 00:47:06.443941,1.0,L2,0.00012865681082993796,128,4,8,AdamW,160,fixed,1.0517503795663907e-06,8,COMPLETE
12,30.148077774047852,2026-10-05 04:26:55.340475,2026-10-05 05:14:03.963496,0 days 00:47:08.623021,1.0,L2,0.00011323588149432456,128,4,8,AdamW,160,fixed,1.1930220880472108e-06,8,COMPLETE
13,29.98004493713379,2026-10-05 05:14:04.116021,2026-10-05 05:56:36.582608,0 days 00:42:32.466587,1.0,L2,8.899836557699988e-05,128,3,8,AdamW,160,fixed,1.6073255162665529e-06,8,COMPLETE
14,30.273069763183592,2026-10-05 05:56:36.722792,2026-10-05 06:40:17.716183,0 days 00:43:40.993391,1.0,L2,0.00023988391780490982,112,3,8,AdamW,160,fixed,1.783129864452785e-05,8,COMPLETE
15,30.24274101257324,2026-10-05 06:40:17.880175,2026-10-05 07:24:52.185375,0 days 00:44:34.305200,1.0,L2,0.00023613012978386823,112,3,8,AdamW,160,fixed,1.7981974049807167e-05,6,COMPLETE
16,30.10407485961914,2026-10-05 07:24:52.304886,2026-10-05 08:06:00.867777,0 days 00:41:08.562891,1.0,L2,0.00023153773291103763,112,3,8,AdamW,192,fixed,1.2426790351179564e-05,6,COMPLETE
17,30.324059295654298,2026-10-05 08:06:00.985113,2026-10-05 08:50:19.128238,0 days 00:44:18.143125,2.0,Huber,0.0002720063310043572,112,3,8,AdamW,160,fixed,2.2929169520823303e-05,6,COMPLETE
18,30.331137466430665,2026-10-05 08:50:19.273287,2026-10-05 09:34:42.438813,0 days 00:44:23.165526,2.0,Huber,0.00046475224814927643,112,3,2,AdamW,160,fixed,6.215095894860666e-05,6,COMPLETE
19,28.001295852661134,2026-10-05 09:34:42.578373,2026-10-05 09:39:47.309827,0 days 00:05:04.731454,2.0,Huber,0.0004014206277590223,32,2,2,AdamW,192,step,5.9288580747064396e-05,6,PRUNED
20,30.307641220092773,2026-10-05 09:39:47.443116,2026-10-05 10:25:09.333450,0 days 00:45:21.890334,2.0,Huber,0.0004896935041724372,104,3,2,AdamW,160,fixed,0.00010724458947047323,6,COMPLETE
21,30.370372772216797,2026-10-05 10:25:09.469617,2026-10-05 11:10:24.151642,0 days 00:45:14.682025,2.0,Huber,0.0004907822809058925,104,3,2,AdamW,160,fixed,0.00012911893660363073,6,COMPLETE
22,30.288009643554688,2026-10-05 11:10:24.281354,2026-10-05 11:55:39.997858,0 days 00:45:15.716504,2.0,Huber,0.0002966288315522379,104,3,2,AdamW,160,fixed,0.00017499909181350782,6,COMPLETE
23,30.364621353149413,2026-10-05 11:55:40.148697,2026-10-05 12:40:38.173094,0 days 00:44:58.024397,2.0,Huber,0.00029857228003618314,120,3,2,AdamW,160,fixed,3.572296853046735e-05,6,COMPLETE
24,30.37883644104004,2026-10-05 12:40:38.299586,2026-10-05 13:21:23.646477,0 days 00:40:45.346891,2.0,Huber,0.00048676053383202745,120,2,2,AdamW,160,fixed,4.1570455816795126e-05,6,COMPLETE
25,28.806259155273438,2026-10-05 13:21:23.788612,2026-10-05 13:28:44.381917,0 days 00:07:20.593305,2.0,Huber,0.0003270688877981729,120,2,2,AdamW,160,fixed,3.751266419322775e-05,6,PRUNED
26,27.231809997558592,2026-10-05 13:28:44.510133,2026-10-05 13:33:36.666327,0 days 00:04:52.156194,2.0,Huber,0.00016584629215733623,96,2,2,AdamW,160,fixed,0.0001834588702471564,6,PRUNED
27,27.486468505859374,2026-10-05 13:33:36.786266,2026-10-05 13:38:31.984428,0 days 00:04:55.198162,2.0,Huber,1.0329037488701705e-05,120,2,2,AdamW,160,fixed,0.00011363780249346328,6,PRUNED
28,29.191316604614258,2026-10-05 13:38:32.113795,2026-10-05 13:50:21.981013,0 days 00:11:49.867218,2.0,Charbonnier,0.0003360524529579286,80,2,2,AdamW,192,step,3.5922837155567076e-05,6,PRUNED
29,27.877987670898438,2026-10-05 13:50:22.106011,2026-10-05 13:56:58.479702,0 days 00:06:36.373691,2.0,Huber,2.5903616482444733e-05,120,3,2,AdamW,128,cosine,0.0002368030242537447,12,PRUNED
30,29.206035995483397,2026-10-05 13:56:58.615516,2026-10-05 14:14:34.939645,0 days 00:17:36.324129,2.0,Huber,0.0002012868765806992,104,3,2,AdamW,128,step,1.0161249843095356e-05,6,PRUNED
31,30.453497695922852,2026-10-05 14:14:35.071260,2026-10-05 14:59:19.203696,0 days 00:44:44.132436,2.0,Huber,0.00048062236222436367,120,3,2,AdamW,160,fixed,6.415362565853938e-05,6,COMPLETE
32,30.324176025390624,2026-10-05 14:59:19.331193,2026-10-05 15:43:57.805867,0 days 00:44:38.474674,2.0,Huber,0.0003508964984375244,120,3,2,AdamW,160,fixed,5.5629693375570595e-05,6,COMPLETE
33,28.866873931884765,2026-10-05 15:43:57.945468,2026-10-05 15:52:23.141326,0 days 00:08:25.195858,2.0,Huber,0.00047556006414631996,88,3,2,AdamW,160,fixed,9.981484785589165e-05,6,PRUNED
34,27.67275390625,2026-10-05 15:52:23.274359,2026-10-05 15:57:14.400607,0 days 00:04:51.126248,1.5,Charbonnier,0.0004979151276967943,120,2,2,ADAM,160,fixed,2.752457679940609e-05,12,PRUNED
35,30.309415435791017,2026-10-05 15:57:14.528505,2026-10-05 16:38:37.525728,0 days 00:41:22.997223,2.0,Huber,0.0003537625431541822,104,2,2,AdamW,160,fixed,0.00029837294363535023,6,COMPLETE
36,25.212924575805665,2026-10-05 16:38:37.672090,2026-10-05 16:43:52.706076,0 days 00:05:15.033986,1.5,Huber,0.00019272885850737863,80,3,4,ADAM,160,cosine,0.0001406050827023479,16,PRUNED
37,30.225135040283202,2026-10-05 16:43:52.838328,2026-10-05 17:29:25.936476,0 days 00:45:33.098148,2.0,L1,0.0003791158791211792,88,4,2,AdamW,192,fixed,4.735693065210736e-05,6,COMPLETE
38,27.815261459350587,2026-10-05 17:29:26.082952,2026-10-05 17:35:09.386750,0 days 00:05:43.303798,2.0,Charbonnier,0.00030856431059649275,128,2,2,ADAM,128,step,7.914625781903862e-05,12,PRUNED
39,27.782330322265626,2026-10-05 17:35:09.517924,2026-10-05 17:39:24.503756,0 days 00:04:14.985832,1.5,Huber,0.0002741006680270905,96,1,4,AdamW,160,cosine,0.00038256852059477363,16,PRUNED
40,27.20605583190918,2026-10-05 17:39:24.619123,2026-10-05 17:44:05.692542,0 days 00:04:41.073419,2.0,Huber,5.9483376927682506e-05,120,2,2,ADAM,160,fixed,2.372703091176211e-05,4,PRUNED
41,26.666092681884766,2026-10-05 17:44:05.804283,2026-10-05 17:49:27.291171,0 days 00:05:21.486888,2.0,Huber,0.0004346082515128779,112,3,2,AdamW,160,fixed,6.459061827127648e-05,6,PRUNED
42,30.366075134277345,2026-10-05 17:49:27.415370,2026-10-05 18:34:28.865698,0 days 00:45:01.450328,2.0,Huber,0.0004974381354623576,112,3,2,AdamW,160,fixed,0.000834657328983546,6,COMPLETE
43,30.35539321899414,2026-10-05 18:34:29.015481,2026-10-05 19:21:41.796046,0 days 00:47:12.780565,2.0,L1,0.00038510666641771905,104,3,2,AdamW,160,fixed,0.0007841339661006904,6,COMPLETE
44,30.451490783691405,2026-10-05 19:21:41.920025,2026-10-05 20:11:14.816980,0 days 00:49:32.896955,2.0,Huber,0.0004039946922743858,120,4,2,AdamW,160,fixed,0.0005537111276384507,6,COMPLETE
45,27.460150909423827,2026-10-05 20:11:14.959064,2026-10-05 20:17:06.207743,0 days 00:05:51.248679,2.0,Huber,2.9863137608416275e-05,128,4,4,AdamW,160,fixed,0.0008649388019195277,6,PRUNED
46,30.284039306640626,2026-10-05 20:17:06.319939,2026-10-05 21:13:49.937769,0 days 00:56:43.617830,2.0,Huber,0.0004987788751500371,72,4,2,AdamW,128,fixed,0.0005670658924197496,4,COMPLETE
47,28.572476959228517,2026-10-05 21:13:50.075504,2026-10-05 21:22:42.488888,0 days 00:08:52.413384,1.5,L1,0.0004020975552650978,112,4,2,AdamW,160,cosine,0.0004300723315255937,16,PRUNED
48,21.726842880249023,2026-10-05 21:22:42.598737,2026-10-05 21:28:25.946476,0 days 00:05:43.347739,2.0,Huber,0.0002607855759450027,128,4,2,ADAM,160,fixed,0.00030229738090428173,6,PRUNED
49,27.936522674560546,2026-10-05 21:28:26.057451,2026-10-05 21:32:19.172246,0 days 00:03:53.114795,2.0,Charbonnier,0.00019239974550312643,96,1,2,AdamW,192,fixed,0.0005263556695188505,6,PRUNED
